sang1331-1,"Kisanga, DR. of the Congo",sang1331,,sng,,,,,Kisanga.htm,"Dr. Anneleen Van der Veken, Royal Museum for Central Africa – Linguistics, Tervuren, Belgium, February 2, 2009."
sang1333-1,"Sangu (Isangu), Gabon",sang1333,,snq,,,,,Sangu.htm,"Dr. Jean A. Blanchon, University of Lyon, France, January 20, 1999."
sang1336-1,"Sangir, Indonesia",sang1336,,sxn,,,,,Sangir.htm,"Dr. Takashi Nakagawa, Department of Linguistics and Multilingual Studies, School of Humanities and Social Sciences, Nanyang Technology University, Singapore, October 15, 2013."
sang1336-2,"Sangir, Indonesia",sang1336,,sxn,,,,,Sangir.htm,"Mr. Ken Maryott, SIL International, July 18, 1996."
sang1337-1,"Sangil, Philippines",sang1337,,snl,,,,,Sangil.htm,"Mr. Donald M. Scheller, SIL International, May 20, 2006."
sang1339-1,"Bakati, Kalimantan, Indonesia",sang1339,,scg,,,,,Bakati.htm,"Dr. Alexander D. Smith, Department of Linguistics, University of North Texas, Denton, Texas, USA, March 15, 2018. Reference sourceː May 2017. The languages of Borneo: a comprehensive classification, Department of Linguistics, University of Hawai‘i. Robert Blust, Chair."
sang1343-1,"Ishkashmi, Tajikistan",sang1343,,sgl,,,,,Ishkashmi.htm,"Mr. Simon Sheshenin, PhD Student, the Institute of Asian and African Studies, (MSU IAAS), Moscow, Russia and Miss Lena Karvovskaya, MA, Department of Linguistics, University of Potsdam, Berlin, Germany, March 15, 2013."
sang1343-2,"Ishkashmi, Tajikistan",sang1343,,sgl,,,,,Ishkashmi.htm,"Dr. Zarifa Nazarova, Institute of Linguistics, Russian Academy of Sciences, Moscow, Russia, July 7, 1991, July 30, 2008."
sani1269-1,"Sani Yi, China",sani1269,,ysn,,,,,Yi-Sani.htm,"Prof. Sun Hongkai, Centre of Minority Languages, Chinese Academy of Sciences, Beijing, China, October 3, 1999."
sanj1286-1,"Ixcatlán Mazatec, Mexico",sanj1286,,maa,,,,,Mazatec-Ixcatlan.htm,"Mr. Benito Fernandez, SIL International, Mexico, September 25, 2011, December 18, 2013."
sank1253-1,"Sankaran Maninka , Guinea",sank1253,,msc,,,,,Maninka-Sankaran.htm,"Mr. Sherry Faris, Pioneer Bible Translator, Guinea, April 5, 2009."
sanm1287-1,"Huave of San Mateo del Mar, Mexico",sanm1287,,huv,,,,,Huave-Mateo-del-Mar.htm,"Miss Yuni Kim, PhD student, Department of Linguistics, Universality of California at Berkeley, USA. 3 January, 2008."
sanm1298-1,"Itunyoso Triqui, Mexico",sanm1298,,trq,,,,,Triqui-Itunyoso.htm,"Dr. Christian DiCanio, Haskin Laboratories at Yale University, USA / Laboratoire Dynamique du Langage CNRS / Université Lyon-2, Lyon, France, March 24, 2013."
sanm1301-1,"Tlacoyalco Popoloca, Mexico",sanm1301,,pls,,,,,Popoloca-Tlacoyalco.htm,"Ms. Sharon Stark, SIL International, April 4, 2008, September 20, 2011."
sanp1260-1,"San Pedro Amuzgo, Mexico",sanp1260,,azg,,,,,Amuzgo-San-Pedro.htm,"Dr. Thomas C. Smith Stark, Center for Lingusitics Studies and Literature ( Centro de Estudios Lingüísticos y Literarios ), Colegio de Mexico, Mexico, March 7, 1990."
sanp1261-1,"Quiatoni Zapotec, Mexico",sanp1261,,zpf,,,,,Zapotec-Quiatoni.htm,"Mr. and Mrs. Valerie and Nicasio Martinez, Wycliffe Bible Translators, April 4, 2008."
sant1410-1,"Santali, India",sant1410,,sat,,,,,Santali.htm,"Dr. Suhnu R. Sharma, Deccan Research College, Pune, India, April 16, 1990. Reference sourceː Neukom, Lukas, 2001. Santali, Languages of the World / Materials 323, Lincom Europa"
sant1424-1,"Santa Teresa Cora, Mexico",sant1424,,cok,,,,,Cora-Santa-Teresa.htm,"Dr. Eugene Casad, SIL International, USA, October 20, 2008, July 24, 2009. November 1, 2010."
sanu1240-1,"Sanumá, Venezuela, Brazil",sanu1240,,xsu,,,,,Sanuma.htm,"Dr. Ernest C. Migliazza, Indiana University, Bloomington, USA, October 28, 2008."
sapa1251-1,"Saparua, Maluku, Indonesia",sapa1251,,spr,,,,,Saparua.htm,"Mr. Russ Roski, SIL-Maluku, February 22, 1988. Taken from SIL linguistic survey list."
sapo1251-1,"Sapo, Liberia",sapo1251,,krn,,,,,Sapo.htm,"Dr. Donald Slager, Informantː Songblen K. Nyongpua. Christian Extension Service, Sierra Leone, January 15, 2008."
sapo1253-1,"Saposa, Papua New Guinea",sapo1253,,sps,,,,,Saposa.htm,"Ms. Marjorie Dubert, SIL-PNG, Papua New Guinea, September, 1995."
sapo1254-1,"Saponi, Papua, Indonesia",sapo1254,,spi,,,,,Saponi.htm,"Mrs. Heljä Clouse, Summer Institute of Linguistics, Indonesia, 1989."
sapu1248-1,"Sapuan, Laos",sapu1248,,spu,,,,,Sapuan.htm,"Miss Pascale Jacq, Linguistics Department, Australian National University, Australia, 11 October 11, 2006"
sara1321-1,"Kaba Na, Chad",sara1321,,kwv,,,,,Kaba-Na.htm,"Mr. David Faris, Summer Institute of Linguistics, Chad, August 19, 1994."
sara1322-1,"Kaba Deme, Chad",sara1322,,kwg,,,,,Kaba-Deme.htm,"Mr. David Faris, Summer Institute of Linguistics, Chad, August 19, 1994."
sara1326-1,"Sarangani Bilaan, Philippines",sara1326,,bps,,,,,Bilaan-Sarangani.htm,"Ms. Barbara Blockburn and Ms. Mary Rhea, SIL International, Philippines, November 28, 1993. October 3, 2009."
sara1327-1,"Sarangani Manobo, Philippines",sara1327,,mbs,,,,,Manobo-Sarangani.htm,"Mr. Carl D. DuBois, SIL International, Philippines. December, 1993. October 3, 2009."
sari1246-1,"Sarikoli, Xinjiang, China",sari1246,,srh,,,,,Sarikoli.htm,"Dr. Pamela Arlund, Director of Training, All Nations Family, USA. February 1, 2013."
sari1246-2,"Sarikoli, China",sari1246,,srh,,,,,Sarikoli.htm,"Prof. Gao Erqing, Centre of Minority Languages, Chinese Academy of Sciences, Beijing, China, July 7, 1991"
sarr1246-1,"Sar, Flores, Indonesia",sarr1246,,,,,,,Sar-NUSA.htm,"Dr. Laura C. Robinson, Department of Linguistics, University of Alaska, Fairbanks, Alaska / Visiting Assistant Professor, Department of Linguistics, University of California, Santa Barbara, USA. December 4, 2013. Data taken fromː Numeral systems in the Alor-Pantar languages, Antoinette Schapper (Universität zu Köln), & Marian Klamer (Leiden University), 2013."
sars1236-1,"Sarcee (Sarsi), Canada",sars1236,,srs,,,,,Sarsi.htm,"Prof. Eung-Do Cook, Department of Linguistics, University of Calgary, Canada, 24 October, 1990"
sart1249-1,"Sartang, India",sart1249,,onp,,,,,Sartang.htm,"Mr. Tim Bodt, PhD Student, Himalayan Languages Projects, Bern University, Switzerland, August 27, 2013."
sart1249-2,"Sartang, India",sart1249,,onp,,,,,Sartang.htm,"Mr. Tim Bodt, PhD Students, Himalayan Languages Projects, Bern University, Switzerland, August 27, 2013."
saru1242-1,"Sarudu, Sulawesi, Indonesia",saru1242,,sdu,,,,,Sarudu.htm,"Dr. Masao Yamaguchi, Setsunan University, Osaka, Japan. June 26, 2006."
sasa1249-1,"Sasak, Lombok, Indonesia",sasa1249,,sas,,,,,Sasak.htm,"Prof. Peter Austin, University of Melbourne, Australia, March 21, 1997/ SOAS, University of London, UK, May 14, 2006."
sass1235-1,"Sassaresu Sardinian (Tattaresu), Italy",sass1235,,sdc,,,,,SassaresuSardinian.htm,"Dr. Roberto Bolognesi and Miss Lucia Grimaldi Universiteit van Amsterdam (University of Amsterdam), Netherlands, October 29, 2002"
sata1237-1,"Satawalese, FSM",sata1237,,stw,,,,,Satawalese.htm,"Mr. Kevin M. Roddy, Department of Linguistics, University of Hawaii at Manoa, Hawaii, USA, April 5, 2010."
sate1242-1,East Frisian (Saterfriesische),sate1242,,stq,,,,,EasttFrisian.htm,"Dr. Marron Fort, 2 August, 2002 Universität Oldenburg, Germany"
sate1243-1,"Sateré-Mawé, Brazil",sate1243,,mav,,,,,Satere-Mawe.htm,"Dr. Sérgio Meira, Paraense Museu Goeldi-CCH, Department Member, Brazil, April 1, 2015."
sate1243-2,"Sateré-Mawé, Brazil",sate1243,,mav,,,,,Satere-Mawe.htm,"Dr. Raynice Geraldine Pereira da Silva. Linguística-UFAM (Universidade Federal do Amazonas / Federal University of Amazonas), Brazil. May 29, 2010. Translated from Portuguese to English by Prof. Ronald B. MacDonell, University of. Florida, USA. June 17, 2010."
sate1243-3,"Sateré-Mawé, Brazil",sate1243,,mav,,,,,Satere-Mawe.htm,"Prof. Wolf Dietrich, University of Muenster, Germany, September 3, 1990."
sauk1252-1,"Sauk (Ma Manda), Papua New Guinea",sauk1252,,skc,,,,,Sauk-Ma-Manda.htm,"Mr. Ryan Pennington, SIL International, Papua New Guinea, June 27, 2011."
saur1248-1,"Saurashtra, India",saur1248,,saz,,,,,Saurashtra.htm,"Mr. S. N. Sankar, Indian Bible Translator, Bible Society of India, Madurai, India, September 22, 1995."
saur1249-1,"Sauria Paharia, Bangladesh, India",saur1249,,mjt,,,,,Malto-Sauria Paharia.htm,"Assistant Professor Mashrur Imtiaz, PhD Researcher, and Prof. Sikder Monoare Murshed, Department of Linguistics, University of Dhaka, Bengal. May 29, 2018. Data taken from LSI (Ethono-linguistic survey of Bangladesh in 2014-2016)."
saur1251-1,"Sauri, Papua, Indonesia",saur1251,,srt,,,,,Sauri.htm,"Mrs. Heljä Clouse, Summer Institute of Linguistics, Indonesia, 1989."
saus1247-1,"Sause, Indonesia",saus1247,,sao,,,,,Sause.htm,"Mrs. Heljä Clouse, Summer Institute of Linguistics, Indonesia, 1989."
savi1242-1,"Savi, Pakistan, Afghanistan",savi1242,,sdg,,,,,Savi.htm,"Dr. Henrik Liljegren, Forum from Language Initiatives / Stockholm University, Sweden, April 9, 2010. Native speaker consultants: Qazi Serajuddin, Inayat ur Rehman (recorded in Jalalabad, Afghanistan in February, 2010)"
savi1242-2,"Savi (Sau), Pakistan",savi1242,,sdg,,,,,Savi.htm,"Dr. Henrik Liljegren, 6 September, 2002 Forum from Language Initiatives / Stockholm University, Sweden"
sawa1247-1,"Weda (Sawai), Indonesia",sawa1247,,szw,,,,,Weda-Sawai.htm,"Mr. Ron Whisler, SIL International, Indonesia, January 3, 1994, March 11, 2014, December 28, 2016"
sawi1256-1,"Sawila, Nusa Tenggara, Indonesia",sawi1256,,swt,,,,,Sawila.htm,"Mr. Beny Ch. Bantara through Ms. Yunita Susanto, August 16, 2007."
sawi1257-1,"Sawi, Papua, Indonesia",sawi1257,,saw,,,,,Sawi.htm,"Pastor Don Richardson (Formerly member of RBMU), October 10, 2014."
sawi1257-2,"Sawi, Papua, Indonesia",sawi1257,,saw,,,,,Sawi.htm,"Mr. Jim Yost ( Formerly member of RBMU), June 2, 2011."
sawk1238-1,"Sawknah (Sokna), Libya",sawk1238,,swn,,,,,Sawknah.htm,"Dr. Marijn van Putten, Center for Linguistics, Leiden University, Netherlands, January 19, 2014."
saxw1241-1,"Saxwe-Gbe, Benin",saxw1241,,sxw,,,,,Saxwe-Gbe.htm,"Mr. Josh Ham, SIL International, Togo-Benin, July 2, 2009."
saya1246-1,"Saya, Nigeria",saya1246,,say,,,,,Saya.htm,"Dr. Andrew Haruna, University of Bayreuth, Germany, November 19, 1994."
scan1238-1,"Scanian, Sweden",scan1238,,scy,,,,,Skane.htm,"Dr.Per Lindblad, Lund University, Sweden, March 27, 2003"
scot1243-1,Modern Scots (Northern Scots),scot1243,,sco,,,,,ModernScots.htm,"Prof. Alexander Bergs, 18 August, 2002 University of Düsseldorf, Germany"
scot1245-1,"Scottish Gaelic, United Kingdom",scot1245,,gla,,,,,ScotGaelic.htm,"Prof. William Gillies, University of Edinburgh, Scotland, United Kingdom, March 19, 2003"
seba1251-1,"Chaha, Ethiopia",seba1251,,sgw,,,,,Chaha.htm,"Dr. Sharon Rose, University of California, San Diego, USA, May 25, 1999."
sebe1242-1,"Seberuang, Kalimantan, Indonesia",sebe1242,,sbx,,,,,Seberuang.htm,"Dr. Alexander D. Smith, Department of Linguistics, University of North Texas, Denton, Texas, USA, March 15, 2018. Reference sourceː May 2017. The languages of Borneo: a comprehensive classification, Department of Linguistics, University of Hawai‘i. Robert Blust, Chair."
sebo1238-1,"Sebop, Malaysia, Indonesia",sebo1238,,sib,,,,,Sebop.htm,"Dr. Alexander D. Smith, Department of Linguistics, University of North Texas, Denton, Texas, USA, March 15, 2018. Reference sourceː May 2017. The languages of Borneo: a comprehensive classification, Department of Linguistics, University of Hawai‘i. Robert Blust, Chair."
sech1246-1,"Sechelt, Canada",sech1246,,sec,,,,,Sechelt.htm,"Prof. M. Dale Kinkade, Department of Linguistics. University of British Columbia, Vancouver, Canada, March 12, 1990. Reference sourceː Timmers, Jan (1977), A classified English-Sechelt word-list. The Netherlands: Peter de Ridder Press. Dr. Jan van Eijk, Department of Linguistics, University of Regina, Regina, Canada, May 8, 1999."
seco1241-1,"Secoya, Ecuador, Peru",seco1241,,sey,,,,,Secoya.htm,"Miss. Rosa Vallejos Yopán, Ph.D. student, Department of Linguistics, University of Oregon, USA, November 16, 2008."
seda1262-1,"Sedang, Vietnam",seda1262,,sed,,,,,Sedang.htm,"Dr. Kenneth D. Smith, SIL International, Thailand, November 21, 1994."
seek1238-1,"Seeku, Burkina Faso",seek1238,,sos,,,,,Seeku.htm,"Ms. Laura McPherson, PhD student, Department of Linguistic, UCLA (University of California at Los Angeles), California, USA, December 1, 2013."
sega1243-1,"Segai (Gaai), Kalimantan, Indonesia",sega1243,,sge,,,,,Segai-Gaai.htm,"Dr. Alexander D. Smith, Department of Linguistics, University of North Texas, Denton, Texas, USA, March 15, 2018. Reference sourceː May 2017. The languages of Borneo: a comprehensive classification, Department of Linguistics, University of Hawai‘i. Robert Blust, Chair."
sege1235-1,"Seget, Papua, Indonesia",sege1235,,sbg,,,,,Seget.htm,"Mrs. Heljä Clouse, Summer Institute of Linguistics, Indonesia, 1989."
sehw1238-1,"Sehwi, Ghana",sehw1238,,sfw,,,,,Sehwi.htm,"Mr. Sammy Ntumy, GILLBT (The Ghana Institute of Linguistics, Literacy and Bible Translation), Ghana, April 11, 2002."
seim1238-1,"Seimat, Papua New Guinea",seim1238,,ssg,,,,,Seimat.htm,"Miss Theresa Wilson, SIL-International, Papua New Guinea, March 14, 2011."
seim1238-2,"Seimat, Papua New Guinea",seim1238,,ssg,,,,,Seimat.htm,"Prof. Robert Blust, Department of Linguistics, University of Hawaii at Manoa, Hawaii, USA, 11 November, 2005."
seka1247-1,"Sekar, Papua, Indonesia",seka1247,,skz,,,,,Sekar.htm,"Mrs. Heljië Clouse, Summer Institute of Linguistics, Irian Jaya, Indonesia. January 11, 1993 Taken from sourceː J. C. Anceaux, Collection of Wordlists of Irian Jaya Languages, A. Austronesian Languages (Part I and Part II), 1992."
seka1248-1,"Sekapan, Malaysia",seka1248,,skp,,,,,Sekapan.htm,"Mr. Shane Bauerle, Doctoral student, Department of Linguistics, University of Hawaii at Manoa, Hawaii, USA. February 21, 2012"
seka1250-1,"Kwadacha Tsek’ene, Sekani, Canada",seka1250,,,,,,,Sekani.htm,"Prof. Sharon Hargus, Department of Linguistics, University of Washington, Seattle, Canada, June 10, 2015."
seke1240-1,"Seke (Tangbe dialect), Nepal",seke1240,,skj,,,,,Seke.htm,"Dr. Isao Honda, University of Nagoya, Osaka, Japan, May 10, 2009."
seke1241-1,"Seke (Ske), Raga Island, Vanuatu",seke1241,,ske,,,,,Seke-Ske.htm,"Mr. Andrew Gray, the author of the bookː The Languages of Pentecost Island, Vanuatu. January 26, 2015. Websiteː http://www.pentecostisland.net/languages/ske/index.htm"
seke1241-2,"Seke (Ske), Raga Island, Vanuatu",seke1241,,ske,,,,,Seke-Ske.htm,"Dr. David Scott Walsh, Department of University of Sydney, Australia. January 19, 2005."
seki1238-1,"Seki, Gabon, Equatorial Guinea",seki1238,,syi,,,,,Seki.htm,"Dr. Yvonne Bastin, Royal Musuem for Central Africa (Musée Royal de l'Afrique Centrale), Université Libre de Bruxelles, Belgium, November 30, 1993."
seko1243-1,"Seko Padang, Sulawesi, Indonesia",seko1243,,skx,,,,,Seko-Padang.htm,"Mr. Michael Matens and Dr. Tom Laskowske, SIL International, January 20, 1994."
sekp1241-1,"Sekpele, Ghana",sekp1241,,lip,,,,,Sekpele.htm,"Dr. Cephas Delalorm, Postgraduate Research, SOAS, University of London, London, U.K., December 21, 2012."
sekp1241-2,"Sekpele, Ghana",sekp1241,,lip,,,,,Sekpele.htm,"Dr. Andy Ring, GILLBT (The Ghana Institute of Linguistics, Literacy and Bible Translation), Ghana, October 11, 2007."
sela1259-1,"Selaru, Maluku, Indonesia",sela1259,,slu,,,,,Selaru.htm,"Dr. David F. Coward, SIL International, January 17, 1994."
sela1260-1,"Selayar, Sulawesi, Indonesia",sela1260,,sly,,,,,Selayar.htm,"Dr. Hasan Basri, State University of New York at Stony Brook, USA. August 7, 1997."
sele1249-1,"Selee (Santrokofi), Ghana",sele1249,,snw,,,,,Selee.htm,"Dr. Andy Ring, GILLBT (The Ghana Institute of Linguistics, Literacy and Bible Translation), Ghana, October 11, 2007."
sele1250-1,"Selepet, Papua New Guinea",sele1250,,spl,,,,,Selepet.htm,"Dr. Ken McElhanon, SIL International, March 14, 2010."
selk1253-1,"Selkup (Northern dialect), Russia",selk1253,,sel,,,,,Selkup-North.htm,"Prof. Eugene Helimski, University of Hamburg, Germany, September 27, 1999."
selu1242-1,"Makatian, Maluku, Indonesia",selu1242,,sws,,,,,Makatian.htm,"Mr. Jock Hughes, SIL International, February 22, 1997."
selu1243-1,"Selungai Murut, Sabah, Malaysia",selu1243,,slg,,,,,Selungai.htm,"Mr. David Moody, SIL International, Sabah, Malaysia, November 6, 1987. Taken from SIL Linguistic survey."
sema1265-1,"Semaq Beri, Malaya Peninsula",sema1265,,szc,,,,,Semaq Beri.htm,"Dr. Nicole Kruspe, Department of Linguistics, University of Melbourne. Australia, August 11, 2006."
sema1266-1,"Semai, Malaya Peninsula",sema1266,,sea,,,,,Semai.htm,"Miss. Sylvia Tufvesson. PhD Student, Max Planck Institute for Psycholinguistics, The Netherlands. January 19, 2010."
sema1266-2,"Semai, Malaya Peninsula",sema1266,,sea,,,,,Semai.htm,"Prof. Gerard Diffloth, University of Chicago, USA, January 18, 1983. Mr. Timothy Phillips (SIL), November 17, 2009. Reference sourceː Means, Paul B, 1977. A Comparative Linguistics Study of three Malayan Aboriginal Tribes."
sema1269-1,"Gerai, Indonesia",sema1269,,,,,,,Gerai-Semandang.htm,"Mr. Paul Gervasi, NTM, Indonesia, November 27, 2013."
semb1240-1,"Sembakung, Sabah, Malaysia",semb1240,,sbr,,,,,Sembakung.htm,"Mr. David Moody, SIL International, Sabah, Malaysia, November 6, 1987. Taken from SIL Linguistic survey."
seme1247-1,"Semelai, Malaya Peninsula",seme1247,,sza,,,,,Semelai.htm,"Dr. Nicole Kruspe, Department of Linguistics, University of Melbourne. Australia, August 11, 2006."
semi1264-1,"Semimi, Papua, Indonesia",semi1264,,etz,,,,,Semimi.htm,"Mrs. Heljä Clouse Summer Institute of Linguistics, Indonesia, 1989."
semn1249-1,"Semnani, Iran",semn1249,,smy,,,,,Semnani.htm,"Mr. Alexander Kolbitsch (M.A.) and Mrs. Mirjam Kolbitsch (M.A.), Institute of Linguistics and Philology, Uppsala University, Sweden, February 19, 2013."
semn1250-1,"Semnam, Malaya Peninsula",semn1250,,ssm,,,,,Semnam.htm,"Dr. Niclas Burenhult, Max-Planck-Institute for Psycholinguistics, Netherlands, August 18, 2006."
sena1268-1,"Senaya, Iran, USA and Australia",sena1268,,syn,,,,,Senaya.htm,"Ms. Laura McPherson, PhD student, Department of Linguistic, UCLA (University of California at Los Angeles), California, USA. April 23, 2012."
sene1264-1,"Seneca, USA, Canada",sene1264,,see,,,,,Seneca.htm,"Prof. Wallace Chafe, Department of Linguistics, University of California, Santa Barbara, USA. March 2, 1994, August 18, 2013."
seng1278-1,"Sengele, DR. of the Congo, Congo",seng1278,,szg,,,,,Sengele.htm,"Prof. Jacques Nkiene (ISP Kikwit- RD. Congo), Institut Supérieur Pédagogique de Kikwit – Bandundu, Democratic Republic of the Congo, April 21, 2012."
senh1238-1,"Senhaja Berber, Morocco",senh1238,,sjs,,,,,Senhaja-Berber.htm,"Miss Jenia Gutova, Ph.D student in linguistics, Center for Linguistics, Leiden University, Netherlands, January 24, 2014. Sound recorded with Mr. Youssef from the village of Beni Ahmed, Ketama region on April 29, 2014 from Ketama dialect Senhaja Berber."
sent1260-1,"Senthang Chin, Myanmar",sent1260,,sez,,,,,Chin-Senthang.htm,"Ms. Mai Ngun Tin Par, Payap University, Chiangmai, Thailand. April 22, 2013."
sepa1241-1,"Sepa, Papua New Guinea",sepa1241,,spe,,,,,Sepa-PNG.htm,"Prof. Malcolm Ross, Department of Linguistics, Australian National University, Canberra, Australia. November 23, 1992."
sepa1242-1,"Sepa, Maluku, Indonesia",sepa1242,,spb,,,,,Sepa-Maluku.htm,"Mr. Russ Roski, SIL-Maluku, February 22, 1988. Taken from SIL linguistic survey list."
sepe1240-1,"Sepen, Papua New Guinea",sepe1240,,spm,,,,,Sepen-Akukem.htm,"Mr. Don R. Daniels, PhD student, Department of Linguistics, University of California, Santa Barbara, USA. October 2, 2010."
sera1259-1,"Siraiki (Seraiki), India, Pakistan",sera1259,,skr,,,,,Siraiki.htm,"Miss Deepshikha Misra, Research Scholar, through Prof. Vaishna Narang, Centre for Linguistics, Jawaharlal Nehru University, New Delhi- 110067, India, September 27, 2013"
sera1259-2,"Siraiki, Pakistan",sera1259,,skr,,,,,Siraiki.htm,"Teyyeb Saleem through Dr. Richard Hoyle, Summer Institute of Linguistics, Pakistan, January 25, 2007."
serb1264-1,Serbian,serb1264,,srp,,,,,SerboCroat.htm,"Dr. Snjezana Kordic, 23 August, 1999 University of Münster, Germany"
sere1260-1,"Sereer-Sine, Senegal, Gambia",sere1260,,srr,,,,,Serer-Sine.htm,"Dr. Marie Renaudier, PhD in Linguistics, University Lyon 2 / Dynamique Du Langage, France. November 19, 2012. Reference: Faye, W. C., 1979, Etude morphosyntaxique du sereer singandrum."
sere1260-2,"Serer-Sine, Senegal, Gambia",sere1260,,srr,,,,,Serer-Sine.htm,"Ms. Katriina Mäkelä, La Mission Lutherienne du Senegal / Lutheran Mission of Senegal, Senegal, April 19, 1989."
seri1255-1,"Serili, Indonesia",seri1255,,sve,,,,,Serili.htm,"Mr. Mark Taber and Mr. Bryan Hinton, SIL International, January 21, 1997. Taken from SIL linguistic survey list."
seri1257-1,"Seri, Mexico",seri1257,,sei,,,,,Seri.htm,"Dr. Stephen A. Marlett, SIL International. Mexico, July 5, 2008."
serr1255-1,"Serrano, USA",serr1255,,ser,,,,,Serrano.htm,"Dr. Kenneth C. Hill, University of Arizona, USA, July 18, 1994."
seru1244-1,"Serui-Laut (Arui), Papua, Indonesia",seru1244,,seu,,,,,Serui-Laut.htm,"Mr. Marcel de Jong, GKII/ GKITP (Gereja Kristen Indonesia, Indonesian Christian Church), Papua, Indonesia, February 21, 2015."
seru1244-2,"Serui-Laut, Papua, Indonesia",seru1244,,seu,,,,,Serui-Laut.htm,"Mr. David Kamholz. PhD student, Department of Linguistics, University of California at Berkeley, USA. February 16, 2015. Reference: Slump, F. 1924-38. Grammatica en woordenlijst van de Seroei-Laut taal. Het Utrechts Archief, nummer toegang 2274, inventarisnummer 1102-1."
seru1244-3,"Serui-Laut, Papua, Indonesia",seru1244,,seu,,,,,Serui-Laut.htm,"Mr. Paul van Velzen, Leiden University, Netherlands, June 19, 2013."
seru1245-1,"Serua, Seram Island, Indonesia",seru1245,,srw,,,,,Serua.htm,"Dr. Aone van Engelenhoven, University of Leiden, Netherlands, August 24, 2006."
seru1246-1,"Serudung Murut, Sabah, Malaysia",seru1246,,srk,,,,,Murut-Serudung.htm,"Mr. Byung Hoon Lee, SIL International, Malaysia, October 20, 1997."
seta1246-1,"Setaman, Papua New Guinea",seta1246,,stm,,,,,Setamin.htm,
seve1240-1,"Severn Ojibwa, Ontario, Canada",seve1240,,ojs,,,,,Ojibwa-Severn.htm,"Prof. John O'Meara. Faculty of Education, Lakehead University, Thunder Bay, Ontario, Canada. October 30, 2010."
seve1240-2,"Severn Ojibwa, Canada",seve1240,,ojs,,,,,Ojibwa-Severn.htm,"Mr. Chuck E. Fiero, SIL Intentional, Canada, May 16, 2009. Data collected in 197-?, informant Zeb Beardy."
sewa1251-1,"Sewa Bay, Papua New Guinea",sewa1251,,sew,,,,,Sewa-Bay.htm,"Dr. David Lithgow, SIL International, Papua New Guinea. March 10, 1991."
seze1235-1,"Sezi (Seze / Sezo), Ethiopia",seze1235,,sze,,,,,Seze.htm,"Mr. Girma Mengistu Desta, Lecture, Department of Linguistics, Addis Abba University (also a PhD candidate), April 4, 2012."
seze1235-2,"Seze (Sezo), Ethiopia",seze1235,,sze,,,,,Seze.htm,"Prof. Marvin L. Bender, Southern Illinois University, USA, June 2, 1989. Additional dataː Wedekind, Charlotte, Klaus Wedekind and Ralph Siebert. 2002. ""Third S.L.L.E. survey on languages of the Begi/Asosa area."" SIL Electronic Survey Reports 2002-056."
sgaw1245-1,"Sgaw Karen, Myanmar",sgaw1245,,ksw,,,,,Karen-Sgaw.htm,"Miss. Hsar Shee, MA student, Department of linguistics, Payap University, Chiangmai, Thailand. October 6, 2010."
sgaw1245-2,"Sgaw Karen, Myanmar",sgaw1245,,ksw,,,,,Karen-Sgaw.htm,"Mr. Mark Wannemacher, Summer Institute of Linguistics, Thailand, November 30, 1994."
shab1252-1,"Shabo (Mikeyir), Ethiopia",shab1252,,sbf,,,,,Shabo.htm,"Dr. Pete Unseth, Summer Institute of Linguistics, Ethiopia, October 7, 1993. Dr. Anbessa Teferra, Tel Aviv University, Tel Aviv, Israel, July 1, 2007."
shah1253-1,"Shahmirzadi, Iran",shah1253,,srz,,,,,Shahmirzadi.htm,"Dr. Guiti Shokri, Institute of Linguistics and Philology, Uppsala University, Sweden, February 24, 2013."
shah1253-2,"Shahmirzadi, Iran",shah1253,,srz,,,,,Shahmirzadi.htm,"Mr. Alexander Kolbitsch (M.A.) and Mrs. Mirjam Kolbitsch (M.A.), Institute of Linguistics and Philology, Uppsala University, Sweden, February 19, 2013."
sham1280-1,"Shambala, Tanzania",sham1280,,ksb,,,,,Shambala.htm,"Dr. Justin Willis, The British Institute in Eastern Africa, Nairobi, Kenya, April 6, 1994."
shan1277-1,"Shan, Myanmar, Thailand",shan1277,,shn,,,,,Shan.htm,"Dr. Paulette Hopple, Summer Institute of Linguistics, Thailand, April 10, 2007."
shan1282-1,"Shanga, Nigeria, Benin",shan1282,,sho,,,,,Shanga.htm,"Dr. Ross Jones, SIM International / Bible translation, Nigeria. August 16, 2010, April 4, 2012."
shan1283-1,"Shanenawa, Brazil",shan1283,,swo,,,,,Shanenawa.htm,"Prof. Gláucia Vieira Cândido, State University of Goiás-Anapolis, Brazi. March 26, 2009."
shar1244-1,"Shark Bay, Vanuatu",shar1244,,ssv,,,,,Shark-Bay.htm,"Dr. Darrel Tryon, Department of Linguistics, Australian National University, Canberra, Australia, March 2, 1988."
shar1245-1,"Sharanahua, Peru, Brazil",shar1245,,mcd,,,,,Sharanahua.htm,"Mrs. Marie Scott, SIL International, November 18, 2008."
shar1249-1,"Shawã, Brazil",shar1249,,,,,,,Shawa.htm,"Mr. Emerson Carvalho de Souza, PD students, Department of Linguistics, Universidade Estadual de Campinas (State University of Campinas), Brazil. August 2, 2011."
shat1244-1,"Shatt Damam, Sudan",shat1244,,shj,,,,,Shatt-Damam.htm,"Dr. Pascal Boyeldieu, CNRS-LLACAN (The Centre National de la Recherche Scientifique (National Center for Scientific Research), Paris, France, taken from Field data, November 21, 2013."
shaw1249-1,"Shawnee, Oklahoma, USA",shaw1249,,sjw,,,,,Shawnee.htm,"Dr. David Costa,Department of linguistics, University of California at Berkeley, USA, November 16, 2008."
shee1238-1,"She (Chenhu dialect), China",shee1238,,shx,,,,,She.htm,"Prof. Mao Zongwu, Center for Minority Languages, Institute of Nationality Studies, Chinese Academy of Social Sciences, Beijing, China，February 23, 1995."
